{
  "$schema": "https://json-schema.org/draft/2020-12/schema",
  "$id": "https://qspec.dev/schemas/v1/qspec.json",
  "title": "QSpec v1 resource",
  "type": "object",
  "required": ["apiVersion", "kind", "metadata", "spec"],
  "properties": {
    "$schema": { "type": "string" },
    "apiVersion": { "const": "qspec.dev/v1" },
    "kind": { "type": "string", "minLength": 1 },
    "metadata": { "$ref": "#/$defs/metadata" },
    "spec": { "$ref": "#/$defs/spec" }
  },
  "$defs": {
    "metadata": {
      "type": "object",
      "required": ["name"],
      "properties": {
        "name": { "type": "string", "pattern": "^[a-z][a-z0-9-]*$" },
        "title": { "type": "string" },
        "description": { "type": "string" },
        "tags": { "type": "array", "items": { "type": "string" } }
      }
    },
    "spec": {
      "type": "object",
      "properties": {
        "parameters": { "type": "object", "additionalProperties": { "$ref": "#/$defs/parameter" } },
        "query": { "$ref": "#/$defs/query" },
        "dataset": { "$ref": "#/$defs/dataset" },
        "transforms": { "type": "array", "items": { "$ref": "#/$defs/transform" } },
        "presentation": { "$ref": "#/$defs/presentation" }
      }
    },
    "parameter": {
      "type": "object",
      "required": ["type"],
      "properties": {
        "type": {
          "enum": ["string", "number", "integer", "boolean", "date", "datetime", "enum", "array"]
        },
        "required": { "type": "boolean" },
        "default": true,
        "description": { "type": "string" },
        "values": { "type": "array", "minItems": 1 },
        "items": {
          "type": "object",
          "required": ["type"],
          "properties": {
            "type": { "enum": ["string", "number", "integer", "boolean", "date", "datetime"] }
          }
        },
        "validation": {
          "type": "object",
          "properties": {
            "min": { "type": "number" },
            "max": { "type": "number" },
            "minLength": { "type": "integer", "minimum": 0 },
            "maxLength": { "type": "integer", "minimum": 0 }
          }
        },
        "presentation": {
          "type": "object",
          "properties": {
            "control": { "type": "string" },
            "label": { "type": "string" },
            "placeholder": { "type": "string" },
            "help": { "type": "string" }
          }
        }
      },
      "allOf": [
        {
          "if": { "properties": { "type": { "const": "enum" } }, "required": ["type"] },
          "then": { "required": ["values"] }
        },
        {
          "if": { "properties": { "type": { "const": "array" } }, "required": ["type"] },
          "then": { "required": ["items"] }
        }
      ]
    },
    "binding": {
      "oneOf": [
        { "type": "string", "pattern": "^\\$parameters\\.[A-Za-z_][A-Za-z0-9_]*$" },
        {
          "type": "object",
          "required": ["parameter"],
          "properties": { "parameter": { "type": "string" } }
        },
        {
          "type": "object",
          "required": ["literal"],
          "properties": { "literal": true }
        }
      ]
    },
    "query": {
      "type": "object",
      "required": ["source", "language", "statement"],
      "properties": {
        "source": { "type": "string", "minLength": 1 },
        "language": { "type": "string", "minLength": 1 },
        "statement": true,
        "bindings": { "type": "object", "additionalProperties": { "$ref": "#/$defs/binding" } }
      }
    },
    "fieldType": {
      "enum": ["string", "number", "integer", "boolean", "date", "datetime", "object", "array"]
    },
    "dataset": {
      "type": "object",
      "required": ["fields"],
      "properties": {
        "fields": {
          "type": "object",
          "additionalProperties": {
            "type": "object",
            "required": ["type"],
            "properties": {
              "type": { "$ref": "#/$defs/fieldType" },
              "nullable": { "type": "boolean" },
              "label": { "type": "string" },
              "semanticType": { "type": "string" },
              "format": { "type": "object" }
            }
          }
        }
      }
    },
    "transform": {
      "type": "object",
      "required": ["type"],
      "properties": { "type": { "type": "string", "minLength": 1 } }
    },
    "presentation": {
      "type": "object",
      "required": ["type"],
      "properties": { "type": { "type": "string", "minLength": 1 } }
    }
  }
}
